{
  "$schema": "https://json-schema.org/draft/2020-12/schema",
  "$id": "https://schemas.commandlayer.org/schemas/v1.0.0/trust-verification/verify/v1/receipt.schema.json",
  "title": "CLAS Trust Verify Receipt",
  "description": "A signed receipt proving that a verification action was performed.",
  "type": "object",
  "additionalProperties": false,
  "required": ["version", "family", "verb", "receipt_id", "request", "result", "ts", "proof"],
  "properties": {
    "version": { "const": "1.0.0" },
    "family": { "const": "trust" },
    "verb": { "const": "verify" },
    "receipt_id": {
      "type": "string",
      "minLength": 1
    },
    "request": {
      "$ref": "https://schemas.commandlayer.org/schemas/v1.0.0/trust-verification/verify/v1/request.schema.json"
    },
    "result": {
      "type": "object",
      "additionalProperties": false,
      "required": ["status"],
      "properties": {
        "status": {
          "type": "string",
          "enum": ["verified", "unverified", "invalid", "inconclusive"]
        },
        "reason": { "type": "string" },
        "checks": {
          "type": "array",
          "items": {
            "type": "object",
            "additionalProperties": false,
            "required": ["name", "passed"],
            "properties": {
              "name": { "type": "string" },
              "passed": { "type": "boolean" },
              "detail": { "type": "string" }
            }
          }
        }
      }
    },
    "ts": {
      "type": "string",
      "format": "date-time"
    },
    "proof": {
      "$ref": "https://schemas.commandlayer.org/schemas/trust-verification/_shared/proof.schema.json"
    }
  }
}
