{
  "version": "1.0.0",
  "family": "trust",
  "verb": "verify",
  "receipt_id": "rcpt-verify-20260510-0001",
  "request": {
    "version": "1.0.0",
    "family": "trust",
    "verb": "verify",
    "subject": {
      "type": "execution_receipt",
      "id": "exec-receipt-2026-05-10-001",
      "uri": "cl://receipts/execution/exec-receipt-2026-05-10-001",
      "content_hash": "sha256:aaaaaaaaaaaaaaaaaaaaaaaaaaaaaaaaaaaaaaaaaaaaaaaaaaaaaaaaaaaaaaaa"
    },
    "verification_type": "signature",
    "criteria": {
      "required_signer": "runtime.commandlayer.eth",
      "required_key_id": "cl-key-1",
      "required_signature_alg": "ed25519"
    },
    "context": {
      "environment": "prod-us-east-1",
      "network": "base-mainnet",
      "chain_id": 8453,
      "tenant_id": "tenant-acme-prod",
      "request_id": "req-verify-20260510-0001",
      "correlation_id": "corr-trustflow-20260510-a1"
    }
  },
  "result": {
    "status": "verified",
    "reason": "Signature, signer, and hash all matched policy.",
    "checks": [
      {
        "name": "signature_valid",
        "passed": true,
        "detail": "ed25519 signature verified"
      },
      {
        "name": "signer_allowed",
        "passed": true,
        "detail": "runtime.commandlayer.eth in trusted signer set"
      }
    ]
  },
  "ts": "2026-05-10T12:05:00Z",
  "proof": {
    "canonical": "json.sorted_keys.v1",
    "hash": "sha256:aaaaaaaaaaaaaaaaaaaaaaaaaaaaaaaaaaaaaaaaaaaaaaaaaaaaaaaaaaaaaaaa",
    "alg": "ed25519",
    "signature": "ed25519:demo:9f7c4d1ab3e6c8d14f2a98b7c3d5e1f09a8b7c6d5e4f3029182736455aabbccd",
    "kid": "cl-key-1",
    "signer_id": "runtime.commandlayer.eth"
  }
}
